{"availability":"public","candidate":"936195c24334ae2fbfd5bfd2fbdc45229a431b7c","claim_state":"engineering_alpha","contract":"sos_public_release_pointer_v1","index_path":"releases/download/v0.1.0a7/sos-release-index-v1.json","index_sha256":"b389f4b66f27487486002973d7722b17aa49ac6c1e5e13dcef33ed4e5086589d","maturity":"community_alpha","release_tag":"v0.1.0a7","tree":"66098fb45f35e65cdf02ef3368aecb33e5d77fa0","version":"0.1.0a7"}
